{
  "id": "paperdotnet.storageoptimization",
  "name": "Document storage optimization",
  "version": "1.0.0",
  "publisher": "PaperDotNet",
  "description": "Proposes smaller document images and combines selected photos into searchable PDFs, with approval before replacement.",
  "sdkVersion": "1.0",
  "autoEnable": false,
  "scopes": [],
  "settings": []
}
