{
  "$schema": "../../docs/schemas/extension-manifest.schema.json",
  "id": "samples.receipts",
  "name": "Receipts (sample)",
  "version": "1.0.0",
  "publisher": "PaperDotNet",
  "description": "Sample extension for the receipts package: the workflow action samples.receipts.save turns what the AI read from a receipt (store, date, total, lines) into the receipt's fields and one item per line.",
  "sdkVersion": "1.0",
  "autoEnable": false
}
